{
  "pageId": "sample-design-pass",
  "figmaNodeRefs": ["1:1"],
  "layoutTree": {
    "type": "Page",
    "children": []
  },
  "componentMappings": [
    {
      "figmaNode": "1:1",
      "component": "SampleCard",
      "source": "DESIGN_SYSTEM",
      "confidence": 0.99
    }
  ],
  "designTokens": ["color.text.primary"],
  "a11yRequirements": ["button has aria-label"],
  "interactionModel": [
    {
      "state": "ready",
      "expectation": "card visible"
    }
  ],
  "knownRisks": [],
  "unknowns": []
}
